[
 {
  "app_id": "juice-shop",
  "scan_id": "20261021T090000Z",
  "fingerprint": "6c668292549821d6f3742016bf4371a07524016924cae5a57735ba0ca71cf35f",
  "rule_id": "10038",
  "title": "Content Security Policy (CSP) Header Not Set",
  "severity": "medium",
  "cwe_id": "CWE-693",
  "endpoint": "/",
  "parameter": null,
  "status": "open",
  "evidence_path": "evidence/active-scan.har",
  "description": "Content Security Policy (CSP) is an added layer of security that helps to detect and mitigate certain types of attacks, including Cross Site Scripting (XSS) and data injection attacks. These attacks are used for everything from data theft to site defacement or distribution of malware. CSP provides a set of standard HTTP headers that allow website owners to declare approved sources of content that browsers should be allowed to load on that page \u2014 covered types are JavaScript, CSS, HTML frames, fonts, images and embeddable objects such as Java applets, ActiveX, audio and video files.",
  "solution": "Ensure that your web server, application server, load balancer, etc. is configured to set the Content-Security-Policy header.",
  "references": [
   "https://developer.mozilla.org/en-US/docs/Web/HTTP/Guides/CSP",
   "https://cheatsheetseries.owasp.org/cheatsheets/Content_Security_Policy_Cheat_Sheet.html",
   "https://www.w3.org/TR/CSP/",
   "https://w3c.github.io/webappsec-csp/",
   "https://web.dev/articles/csp",
   "https://caniuse.com/#feat=contentsecuritypolicy",
   "https://content-security-policy.com/"
  ],
  "confidence": "high",
  "request_line": "GET /",
  "response_status": 200,
  "exchange_path": "evidence/messages/6c668292549821d6f3742016bf4371a07524016924cae5a57735ba0ca71cf35f.txt"
 },
 {
  "app_id": "juice-shop",
  "scan_id": "20261021T090000Z",
  "fingerprint": "b79dcc35cacb16f2e50f71821be1e55eb9e8dd53487ae09cbced65d5f5e62ad9",
  "rule_id": "10098",
  "title": "Cross-Domain Misconfiguration",
  "severity": "medium",
  "cwe_id": "CWE-264",
  "endpoint": "/styles.css",
  "parameter": null,
  "status": "open",
  "evidence_path": "evidence/active-scan.har",
  "description": "Web browser data loading may be possible, due to a Cross Origin Resource Sharing (CORS) misconfiguration on the web server.",
  "solution": "Ensure that sensitive data is not available in an unauthenticated manner (using IP address white-listing, for instance).\nConfigure the \"Access-Control-Allow-Origin\" HTTP header to a more restrictive set of domains, or remove all CORS headers entirely, to allow the web browser to enforce the Same Origin Policy (SOP) in a more restrictive manner.",
  "references": [
   "https://vulncat.fortify.com/en/detail?category=HTML5&subcategory=Overly%20Permissive%20CORS%20Policy"
  ],
  "confidence": "medium",
  "evidence_excerpt": "Access-Control-Allow-Origin: *",
  "request_line": "GET /styles.css",
  "response_status": 200,
  "exchange_path": "evidence/messages/b79dcc35cacb16f2e50f71821be1e55eb9e8dd53487ae09cbced65d5f5e62ad9.txt"
 },
 {
  "app_id": "juice-shop",
  "scan_id": "20261021T090000Z",
  "fingerprint": "60f1d62bef7b7e17ef6c51cf7f17c0f1ca444acb6e690b29140093dd95e58388",
  "rule_id": "10098",
  "title": "Cross-Domain Misconfiguration",
  "severity": "medium",
  "cwe_id": "CWE-264",
  "endpoint": "/",
  "parameter": null,
  "status": "open",
  "evidence_path": "evidence/active-scan.har",
  "description": "Web browser data loading may be possible, due to a Cross Origin Resource Sharing (CORS) misconfiguration on the web server.",
  "solution": "Ensure that sensitive data is not available in an unauthenticated manner (using IP address white-listing, for instance).\nConfigure the \"Access-Control-Allow-Origin\" HTTP header to a more restrictive set of domains, or remove all CORS headers entirely, to allow the web browser to enforce the Same Origin Policy (SOP) in a more restrictive manner.",
  "references": [
   "https://vulncat.fortify.com/en/detail?category=HTML5&subcategory=Overly%20Permissive%20CORS%20Policy"
  ],
  "confidence": "medium",
  "evidence_excerpt": "Access-Control-Allow-Origin: *",
  "request_line": "GET /",
  "response_status": 200,
  "exchange_path": "evidence/messages/60f1d62bef7b7e17ef6c51cf7f17c0f1ca444acb6e690b29140093dd95e58388.txt"
 },
 {
  "app_id": "juice-shop",
  "scan_id": "20261021T090000Z",
  "fingerprint": "3b981efaab7c7e9c1099c9ec7487435638a9c355d3ba66d9f2a0e5e1711bea73",
  "rule_id": "10098",
  "title": "Cross-Domain Misconfiguration",
  "severity": "medium",
  "cwe_id": "CWE-264",
  "endpoint": "/polyfills.js",
  "parameter": null,
  "status": "open",
  "evidence_path": "evidence/active-scan.har",
  "description": "Web browser data loading may be possible, due to a Cross Origin Resource Sharing (CORS) misconfiguration on the web server.",
  "solution": "Ensure that sensitive data is not available in an unauthenticated manner (using IP address white-listing, for instance).\nConfigure the \"Access-Control-Allow-Origin\" HTTP header to a more restrictive set of domains, or remove all CORS headers entirely, to allow the web browser to enforce the Same Origin Policy (SOP) in a more restrictive manner.",
  "references": [
   "https://vulncat.fortify.com/en/detail?category=HTML5&subcategory=Overly%20Permissive%20CORS%20Policy"
  ],
  "confidence": "medium",
  "evidence_excerpt": "Access-Control-Allow-Origin: *",
  "request_line": "GET /polyfills.js",
  "response_status": 200,
  "exchange_path": "evidence/messages/3b981efaab7c7e9c1099c9ec7487435638a9c355d3ba66d9f2a0e5e1711bea73.txt"
 },
 {
  "app_id": "juice-shop",
  "scan_id": "20261021T090000Z",
  "fingerprint": "9154012d3b7fb1cbcc2021c8c44b43f5b4141515ff07ce69d19145741023798f",
  "rule_id": "10098",
  "title": "Cross-Domain Misconfiguration",
  "severity": "medium",
  "cwe_id": "CWE-264",
  "endpoint": "/scripts.js",
  "parameter": null,
  "status": "open",
  "evidence_path": "evidence/active-scan.har",
  "description": "Web browser data loading may be possible, due to a Cross Origin Resource Sharing (CORS) misconfiguration on the web server.",
  "solution": "Ensure that sensitive data is not available in an unauthenticated manner (using IP address white-listing, for instance).\nConfigure the \"Access-Control-Allow-Origin\" HTTP header to a more restrictive set of domains, or remove all CORS headers entirely, to allow the web browser to enforce the Same Origin Policy (SOP) in a more restrictive manner.",
  "references": [
   "https://vulncat.fortify.com/en/detail?category=HTML5&subcategory=Overly%20Permissive%20CORS%20Policy"
  ],
  "confidence": "medium",
  "evidence_excerpt": "Access-Control-Allow-Origin: *",
  "request_line": "GET /scripts.js",
  "response_status": 200,
  "exchange_path": "evidence/messages/9154012d3b7fb1cbcc2021c8c44b43f5b4141515ff07ce69d19145741023798f.txt"
 },
 {
  "app_id": "juice-shop",
  "scan_id": "20261021T090000Z",
  "fingerprint": "f13a8c809e03a62eb4d4086d100c79b91dd299a80ef39520ebe9e215ed54fe53",
  "rule_id": "10096",
  "title": "Timestamp Disclosure - Unix",
  "severity": "low",
  "cwe_id": "CWE-497",
  "endpoint": "/styles.css",
  "parameter": null,
  "status": "open",
  "evidence_path": "evidence/active-scan.har",
  "description": "A timestamp was disclosed by the application/web server. - Unix",
  "solution": "Manually confirm that the timestamp data is not sensitive, and that the data cannot be aggregated to disclose exploitable patterns.",
  "references": [
   "https://cwe.mitre.org/data/definitions/200.html"
  ],
  "confidence": "low",
  "evidence_excerpt": "1528301887"
 },
 {
  "app_id": "juice-shop",
  "scan_id": "20261021T090000Z",
  "fingerprint": "f13a8c809e03a62eb4d4086d100c79b91dd299a80ef39520ebe9e215ed54fe53",
  "rule_id": "10096",
  "title": "Timestamp Disclosure - Unix",
  "severity": "low",
  "cwe_id": "CWE-497",
  "endpoint": "/styles.css",
  "parameter": null,
  "status": "open",
  "evidence_path": "evidence/active-scan.har",
  "description": "A timestamp was disclosed by the application/web server. - Unix",
  "solution": "Manually confirm that the timestamp data is not sensitive, and that the data cannot be aggregated to disclose exploitable patterns.",
  "references": [
   "https://cwe.mitre.org/data/definitions/200.html"
  ],
  "confidence": "low",
  "evidence_excerpt": "1578947368"
 },
 {
  "app_id": "juice-shop",
  "scan_id": "20261021T090000Z",
  "fingerprint": "f13a8c809e03a62eb4d4086d100c79b91dd299a80ef39520ebe9e215ed54fe53",
  "rule_id": "10096",
  "title": "Timestamp Disclosure - Unix",
  "severity": "low",
  "cwe_id": "CWE-497",
  "endpoint": "/styles.css",
  "parameter": null,
  "status": "open",
  "evidence_path": "evidence/active-scan.har",
  "description": "A timestamp was disclosed by the application/web server. - Unix",
  "solution": "Manually confirm that the timestamp data is not sensitive, and that the data cannot be aggregated to disclose exploitable patterns.",
  "references": [
   "https://cwe.mitre.org/data/definitions/200.html"
  ],
  "confidence": "low",
  "evidence_excerpt": "1602209945"
 },
 {
  "app_id": "juice-shop",
  "scan_id": "20261021T090000Z",
  "fingerprint": "f13a8c809e03a62eb4d4086d100c79b91dd299a80ef39520ebe9e215ed54fe53",
  "rule_id": "10096",
  "title": "Timestamp Disclosure - Unix",
  "severity": "low",
  "cwe_id": "CWE-497",
  "endpoint": "/styles.css",
  "parameter": null,
  "status": "open",
  "evidence_path": "evidence/active-scan.har",
  "description": "A timestamp was disclosed by the application/web server. - Unix",
  "solution": "Manually confirm that the timestamp data is not sensitive, and that the data cannot be aggregated to disclose exploitable patterns.",
  "references": [
   "https://cwe.mitre.org/data/definitions/200.html"
  ],
  "confidence": "low",
  "evidence_excerpt": "1636363636"
 },
 {
  "app_id": "juice-shop",
  "scan_id": "20261021T090000Z",
  "fingerprint": "f13a8c809e03a62eb4d4086d100c79b91dd299a80ef39520ebe9e215ed54fe53",
  "rule_id": "10096",
  "title": "Timestamp Disclosure - Unix",